{
  "aliases": [],
  "domains": [],
  "id": "linguistics:semantics:plural-and-collective-interpretation",
  "kind": "domain",
  "label": "Plural and collective interpretation",
  "parents": [
    "linguistics:semantics"
  ],
  "relations": [],
  "roles": [],
  "schema": "kps:12:entity",
  "scope": "Semantics: plural and collective interpretation. This is a provisional scope entry; zero classified entities means an explicit coverage gap.",
  "status": "draft",
  "top_level": false,
  "version": "0.1.0"
}
