{
  "aliases": [],
  "domains": [],
  "id": "linguistics:phonology:phonological-processes",
  "kind": "domain",
  "label": "Phonological processes",
  "parents": [
    "linguistics:phonology"
  ],
  "relations": [],
  "roles": [],
  "schema": "kps:12:entity",
  "scope": "Phonology: phonological processes. This is a provisional scope entry; zero classified entities means an explicit coverage gap.",
  "status": "draft",
  "top_level": false,
  "version": "0.1.0"
}
