{
  "about": "english:realization-varies-with-environment",
  "aliases": [],
  "assessment": "Preserves an existing document citation. No claim-level support is inferred by migration.",
  "assessment_relation": "context-only",
  "domains": [],
  "id": "english:evidence:d4df522d799f21e454daa0de",
  "inspection_extent": "Historical source-record inspection extent is retained; migration performs no new source inspection.",
  "kind": "evidence",
  "label": "Phonetic realization varies with environment — legacy source context",
  "locator": null,
  "record_origin": "legacy-citation-migration",
  "relations": [],
  "roles": [],
  "schema": "kps:12:entity",
  "source": "english:anderson-2018-essentials-of-linguistics",
  "status": "draft",
  "version": "0.1.0"
}
