{
  "aliases": [],
  "domains": [
    "linguistics:morphology",
    "linguistics:morphology:allomorphy",
    "linguistics:phonology"
  ],
  "evidence_status": "provisional",
  "extraction": "key-takeaway-only",
  "granularity": "summary-not-assumed-atomic",
  "id": "english:exponents-are-conditioned-by-sound:claim:key-takeaway",
  "kind": "claim",
  "label": "Regular inflectional exponents are conditioned by stem sounds — summary claim",
  "owner": "english:exponents-are-conditioned-by-sound",
  "owner_version": "0.2.0",
  "relations": [],
  "reviewed": null,
  "roles": [],
  "schema": "kps:12:entity",
  "scope": "Only the qualified summary in the named owner; its assumptions, variety limits, examples and nonclaims remain in the full content.",
  "statement": "Regular English plural and past endings vary with the relevant final sound of the base rather than its last written letter.",
  "status": "draft",
  "version": "0.1.0"
}
