{
  "about": "english:validation-does-not-establish-truth",
  "aliases": [],
  "assessment": "Preserves an existing document citation. No claim-level support is inferred by migration.",
  "assessment_relation": "context-only",
  "domains": [],
  "id": "english:evidence:5a1d41e7eea3746de0757ac0",
  "inspection_extent": "Historical source-record inspection extent is retained; migration performs no new source inspection.",
  "kind": "evidence",
  "label": "Structural validation does not establish linguistic truth — legacy source context",
  "locator": null,
  "record_origin": "legacy-citation-migration",
  "relations": [],
  "roles": [],
  "schema": "kps:12:entity",
  "source": "english:xiongxianfei-2026-knowledge-practice-system",
  "status": "draft",
  "version": "0.1.0"
}
