{
  "aliases": [],
  "domains": [
    "linguistics:lexicon",
    "linguistics:lexicon:lexical-identity",
    "linguistics:morphology",
    "linguistics:morphology:morphological-units"
  ],
  "evidence_status": "provisional",
  "extraction": "key-takeaway-only",
  "granularity": "summary-not-assumed-atomic",
  "id": "english:lexeme-and-word-form:claim:key-takeaway",
  "kind": "claim",
  "label": "Lexeme and word form — summary claim",
  "owner": "english:lexeme-and-word-form",
  "owner_version": "0.2.0",
  "relations": [],
  "reviewed": null,
  "roles": [],
  "schema": "kps:12:entity",
  "scope": "Only the qualified summary in the named owner; its assumptions, variety limits, examples and nonclaims remain in the full content.",
  "statement": "A lexeme is an abstract lexical identity associated with a family of grammatical forms.",
  "status": "draft",
  "version": "0.1.0"
}
