{
  "aliases": [
    "english:concept:negation-and-entailment"
  ],
  "basis_kind": "AI-assisted authored synthesis and constructed examples; independent review pending",
  "claim_extraction": "summary-only; all other body assertions require claim-by-claim review",
  "claims": [
    "english:negation-and-entailment:claim:key-takeaway"
  ],
  "content": "knowledge/negation-and-entailment.md",
  "domains": [
    "linguistics:semantics",
    "linguistics:semantics:negation-and-entailment"
  ],
  "evidence_status": "provisional",
  "id": "english:negation-and-entailment",
  "kind": "knowledge",
  "label": "Negation and entailment",
  "migration": {
    "base_commit": "034f21daa6946b744b367515cb4dbfc6a6720c4f",
    "legacy_metadata": {
      "basis_kind": "AI-assisted authored synthesis and constructed examples; independent review pending",
      "evidence_status": "provisional",
      "id": "english:concept:negation-and-entailment",
      "language": "KPS 9.x",
      "perspectives": [
        "semantics"
      ],
      "references": [],
      "reviewed": null,
      "source_status": "external-support-pending",
      "stages": [
        3
      ],
      "status": "draft",
      "type": "concept",
      "uses_concepts": [
        "english:concept:quantification-and-scope",
        "english:concept:presupposition",
        "english:concept:implicature"
      ],
      "version": "0.1.0"
    },
    "old_id": "english:concept:negation-and-entailment",
    "old_path": "concepts/negation-and-entailment.md",
    "old_version": "0.1.0"
  },
  "relations": [
    {
      "expected_target_role": "kps:role:concept",
      "legacy_predicate": "uses_concepts",
      "predicate": "kps:uses",
      "target": "english:quantification-and-scope"
    },
    {
      "expected_target_role": "kps:role:concept",
      "legacy_predicate": "uses_concepts",
      "predicate": "kps:uses",
      "target": "english:presupposition"
    },
    {
      "expected_target_role": "kps:role:concept",
      "legacy_predicate": "uses_concepts",
      "predicate": "kps:uses",
      "target": "english:implicature"
    }
  ],
  "reviewed": null,
  "roles": [
    "kps:role:concept"
  ],
  "schema": "kps:12:entity",
  "sequences": [
    {
      "positions": [
        3
      ],
      "scheme": "english:legacy-route"
    }
  ],
  "source_status": "external-support-pending",
  "status": "draft",
  "version": "0.2.0"
}
