{
  "aliases": [
    "english:principle:validation-does-not-establish-truth"
  ],
  "basis_kind": "AI-assisted authored synthesis and constructed examples; independent review pending",
  "claim_extraction": "summary-only; all other body assertions require claim-by-claim review",
  "claims": [
    "english:validation-does-not-establish-truth:claim:key-takeaway"
  ],
  "content": "knowledge/validation-does-not-establish-truth.md",
  "domains": [
    "kps:knowledge-maintenance"
  ],
  "evidence_status": "provisional",
  "id": "english:validation-does-not-establish-truth",
  "kind": "knowledge",
  "label": "Structural validation does not establish linguistic truth",
  "migration": {
    "base_commit": "034f21daa6946b744b367515cb4dbfc6a6720c4f",
    "legacy_metadata": {
      "basis_kind": "AI-assisted authored synthesis and constructed examples; independent review pending",
      "evidence_status": "provisional",
      "id": "english:principle:validation-does-not-establish-truth",
      "language": "KPS 9.x",
      "perspectives": [
        "interfaces-and-integration"
      ],
      "references": [
        "english:reference:xiongxianfei-2026-knowledge-practice-system"
      ],
      "reviewed": null,
      "source_status": "selected-support-only",
      "stages": [
        7
      ],
      "status": "draft",
      "type": "principle",
      "uses_concepts": [
        "english:concept:evidence-and-analysis",
        "english:concept:interface"
      ],
      "version": "0.1.0"
    },
    "old_id": "english:principle:validation-does-not-establish-truth",
    "old_path": "principles/validation-does-not-establish-truth.md",
    "old_version": "0.1.0"
  },
  "relations": [
    {
      "expected_target_role": "kps:role:concept",
      "legacy_predicate": "uses_concepts",
      "predicate": "kps:uses",
      "target": "english:evidence-and-analysis"
    },
    {
      "expected_target_role": "kps:role:concept",
      "legacy_predicate": "uses_concepts",
      "predicate": "kps:uses",
      "target": "english:interface"
    },
    {
      "legacy_predicate": "references",
      "predicate": "kps:cites",
      "target": "english:xiongxianfei-2026-knowledge-practice-system"
    }
  ],
  "reviewed": null,
  "roles": [
    "kps:role:principle"
  ],
  "schema": "kps:12:entity",
  "sequences": [
    {
      "positions": [
        7
      ],
      "scheme": "english:legacy-route"
    }
  ],
  "source_status": "selected-support-only",
  "status": "draft",
  "version": "0.2.0"
}
