{
  "aliases": [
    "english:concept:semantic-role"
  ],
  "basis_kind": "AI-assisted authored synthesis and constructed examples; independent review pending",
  "claim_extraction": "summary-only; all other body assertions require claim-by-claim review",
  "claims": [
    "english:semantic-role:claim:key-takeaway"
  ],
  "content": "knowledge/semantic-role.md",
  "domains": [
    "linguistics:semantics",
    "linguistics:semantics:participant-roles"
  ],
  "evidence_status": "provisional",
  "id": "english:semantic-role",
  "kind": "knowledge",
  "label": "Semantic role",
  "migration": {
    "base_commit": "034f21daa6946b744b367515cb4dbfc6a6720c4f",
    "legacy_metadata": {
      "basis_kind": "AI-assisted authored synthesis and constructed examples; independent review pending",
      "evidence_status": "provisional",
      "id": "english:concept:semantic-role",
      "language": "KPS 9.x",
      "perspectives": [
        "semantics"
      ],
      "references": [
        "english:reference:anderson-2018-essentials-of-linguistics"
      ],
      "reviewed": null,
      "source_status": "selected-support-only",
      "stages": [
        3
      ],
      "status": "draft",
      "type": "concept",
      "uses_concepts": [
        "english:concept:category-and-function",
        "english:concept:semantic-predicate",
        "english:concept:object-and-pp-complement"
      ],
      "version": "0.1.0"
    },
    "old_id": "english:concept:semantic-role",
    "old_path": "concepts/semantic-role.md",
    "old_version": "0.1.0"
  },
  "relations": [
    {
      "expected_target_role": "kps:role:concept",
      "legacy_predicate": "uses_concepts",
      "predicate": "kps:uses",
      "target": "english:category-and-function"
    },
    {
      "expected_target_role": "kps:role:concept",
      "legacy_predicate": "uses_concepts",
      "predicate": "kps:uses",
      "target": "english:semantic-predicate"
    },
    {
      "expected_target_role": "kps:role:concept",
      "legacy_predicate": "uses_concepts",
      "predicate": "kps:uses",
      "target": "english:object-and-pp-complement"
    },
    {
      "legacy_predicate": "references",
      "predicate": "kps:cites",
      "target": "english:anderson-2018-essentials-of-linguistics"
    }
  ],
  "reviewed": null,
  "roles": [
    "kps:role:concept"
  ],
  "schema": "kps:12:entity",
  "sequences": [
    {
      "positions": [
        3
      ],
      "scheme": "english:legacy-route"
    }
  ],
  "source_status": "selected-support-only",
  "status": "draft",
  "version": "0.2.0"
}
