{
  "aliases": [],
  "domains": [
    "linguistics:syntax",
    "linguistics:syntax:clause-linking"
  ],
  "evidence_status": "provisional",
  "extraction": "key-takeaway-only",
  "granularity": "summary-not-assumed-atomic",
  "id": "english:complement-clause:claim:key-takeaway",
  "kind": "claim",
  "label": "Complement clause — summary claim",
  "owner": "english:complement-clause",
  "owner_version": "0.2.0",
  "relations": [],
  "reviewed": null,
  "roles": [],
  "schema": "kps:12:entity",
  "scope": "Only the qualified summary in the named owner; its assumptions, variety limits, examples and nonclaims remain in the full content.",
  "statement": "A complement clause occupies a position licensed by a head or construction.",
  "status": "draft",
  "version": "0.1.0"
}
