{
  "aliases": [],
  "domains": [],
  "id": "linguistics:pragmatics:speech-actions",
  "kind": "domain",
  "label": "Speech actions",
  "parents": [
    "linguistics:pragmatics"
  ],
  "relations": [],
  "roles": [],
  "schema": "kps:12:entity",
  "scope": "Pragmatics: speech actions. This is a provisional scope entry; zero classified entities means an explicit coverage gap.",
  "status": "draft",
  "top_level": false,
  "version": "0.1.0"
}
