{
  "aliases": [],
  "domains": [
    "linguistics:lexicon",
    "linguistics:semantics"
  ],
  "evidence_status": "provisional",
  "extraction": "key-takeaway-only",
  "granularity": "summary-not-assumed-atomic",
  "id": "english:lexicon-semantics-interface:claim:key-takeaway",
  "kind": "claim",
  "label": "Lexicon Semantics interface — summary claim",
  "owner": "english:lexicon-semantics-interface",
  "owner_version": "0.2.0",
  "relations": [],
  "reviewed": null,
  "roles": [],
  "schema": "kps:12:entity",
  "scope": "Only the qualified summary in the named owner; its assumptions, variety limits, examples and nonclaims remain in the full content.",
  "statement": "A sense-specific lexical entry constrains an interpretation without making a spelling identify one context-independent predicate.",
  "status": "draft",
  "version": "0.1.0"
}
