{
  "aliases": [],
  "domains": [
    "linguistics:morphology",
    "linguistics:morphology:morphological-units"
  ],
  "evidence_status": "provisional",
  "extraction": "key-takeaway-only",
  "granularity": "summary-not-assumed-atomic",
  "id": "english:affix:claim:key-takeaway",
  "kind": "claim",
  "label": "Affix — summary claim",
  "owner": "english:affix",
  "owner_version": "0.2.0",
  "relations": [],
  "reviewed": null,
  "roles": [],
  "schema": "kps:12:entity",
  "scope": "Only the qualified summary in the named owner; its assumptions, variety limits, examples and nonclaims remain in the full content.",
  "statement": "An affix is a bound morphological element attached to a base in the analysis adopted here.",
  "status": "draft",
  "version": "0.1.0"
}
