{
  "acyclic": false,
  "aliases": [],
  "description": "A scoped representation constrains possible analyses of another; not sufficient determination.",
  "domains": [],
  "id": "kps:constrains",
  "kind": "relation-type",
  "label": "constrains",
  "layer": "semantic",
  "relations": [],
  "roles": [],
  "schema": "kps:12:entity",
  "source_kinds": [
    "representation"
  ],
  "status": "draft",
  "target_kinds": [
    "representation"
  ],
  "version": "0.1.0"
}
