{
  "aliases": [
    "english:concept:constraint-and-preference"
  ],
  "basis_kind": "AI-assisted authored synthesis and constructed examples; independent review pending",
  "claim_extraction": "summary-only; all other body assertions require claim-by-claim review",
  "claims": [
    "english:constraint-and-preference:claim:key-takeaway"
  ],
  "content": "knowledge/constraint-and-preference.md",
  "domains": [
    "kps:knowledge-maintenance"
  ],
  "evidence_status": "provisional",
  "id": "english:constraint-and-preference",
  "kind": "knowledge",
  "label": "Constraint and preference",
  "migration": {
    "base_commit": "034f21daa6946b744b367515cb4dbfc6a6720c4f",
    "legacy_metadata": {
      "basis_kind": "AI-assisted authored synthesis and constructed examples; independent review pending",
      "evidence_status": "provisional",
      "id": "english:concept:constraint-and-preference",
      "language": "KPS 9.x",
      "perspectives": [
        "interfaces-and-integration"
      ],
      "references": [],
      "reviewed": null,
      "source_status": "external-support-pending",
      "stages": [
        7
      ],
      "status": "draft",
      "type": "concept",
      "uses_concepts": [
        "english:concept:grammaticality-and-acceptability",
        "english:concept:lexical-selection",
        "english:concept:contextual-resolution"
      ],
      "version": "0.1.0"
    },
    "old_id": "english:concept:constraint-and-preference",
    "old_path": "concepts/constraint-and-preference.md",
    "old_version": "0.1.0"
  },
  "relations": [
    {
      "expected_target_role": "kps:role:concept",
      "legacy_predicate": "uses_concepts",
      "predicate": "kps:uses",
      "target": "english:grammaticality-and-acceptability"
    },
    {
      "expected_target_role": "kps:role:concept",
      "legacy_predicate": "uses_concepts",
      "predicate": "kps:uses",
      "target": "english:lexical-selection"
    },
    {
      "expected_target_role": "kps:role:concept",
      "legacy_predicate": "uses_concepts",
      "predicate": "kps:uses",
      "target": "english:contextual-resolution"
    }
  ],
  "reviewed": null,
  "roles": [
    "kps:role:concept"
  ],
  "schema": "kps:12:entity",
  "sequences": [
    {
      "positions": [
        7
      ],
      "scheme": "english:legacy-route"
    }
  ],
  "source_status": "external-support-pending",
  "status": "draft",
  "version": "0.2.0"
}
