{
  "aliases": [
    "english:concept:category-and-function"
  ],
  "basis_kind": "AI-assisted authored synthesis and constructed examples; independent review pending",
  "claim_extraction": "summary-only; all other body assertions require claim-by-claim review",
  "claims": [
    "english:category-and-function:claim:key-takeaway"
  ],
  "content": "knowledge/category-and-function.md",
  "domains": [
    "linguistics:foundations",
    "linguistics:syntax",
    "linguistics:syntax:syntactic-categories"
  ],
  "evidence_status": "provisional",
  "id": "english:category-and-function",
  "kind": "knowledge",
  "label": "Category and function",
  "migration": {
    "base_commit": "034f21daa6946b744b367515cb4dbfc6a6720c4f",
    "legacy_metadata": {
      "basis_kind": "AI-assisted authored synthesis and constructed examples; independent review pending",
      "evidence_status": "provisional",
      "id": "english:concept:category-and-function",
      "language": "KPS 9.x",
      "perspectives": [
        "foundations"
      ],
      "references": [],
      "reviewed": null,
      "source_status": "external-support-pending",
      "stages": [
        0
      ],
      "status": "draft",
      "type": "concept",
      "uses_concepts": [
        "english:concept:head-and-dependent",
        "english:concept:predicative-complement"
      ],
      "version": "0.1.0"
    },
    "old_id": "english:concept:category-and-function",
    "old_path": "concepts/category-and-function.md",
    "old_version": "0.1.0"
  },
  "relations": [
    {
      "expected_target_role": "kps:role:concept",
      "legacy_predicate": "uses_concepts",
      "predicate": "kps:uses",
      "target": "english:head-and-dependent"
    },
    {
      "expected_target_role": "kps:role:concept",
      "legacy_predicate": "uses_concepts",
      "predicate": "kps:uses",
      "target": "english:predicative-complement"
    }
  ],
  "reviewed": null,
  "roles": [
    "kps:role:concept"
  ],
  "schema": "kps:12:entity",
  "sequences": [
    {
      "positions": [
        0
      ],
      "scheme": "english:legacy-route"
    }
  ],
  "source_status": "external-support-pending",
  "status": "draft",
  "version": "0.2.0"
}
