{
  "aliases": [],
  "domains": [],
  "id": "linguistics:information-structure:focus-projection",
  "kind": "domain",
  "label": "Focus projection",
  "parents": [
    "linguistics:information-structure"
  ],
  "relations": [],
  "roles": [],
  "schema": "kps:12:entity",
  "scope": "Information Structure: focus projection. This is a provisional scope entry; zero classified entities means an explicit coverage gap.",
  "status": "draft",
  "top_level": false,
  "version": "0.1.0"
}
